{
  "$schema": "https://json-schema.org/draft/2020-12/schema",
  "$id": "https://wulfquest.invalid/schema/landmarks.schema.json",
  "title": "world/landmarks.json — AGENTS.md §14",
  "type": "object",
  "additionalProperties": false,
  "required": ["schemaVersion", "fidelity", "startFacing", "exit", "lairs", "amuletSets", "amulet", "shrines", "items", "hint", "temple"],
  "properties": {
    "schemaVersion": { "type": "integer", "minimum": 1 },
    "fidelity": { "enum": ["recon", "canon"] },
    "startFacing": { "enum": ["N", "NE", "E", "SE", "S", "SW", "W", "NW"] },
    "exit": {
      "type": "object", "additionalProperties": false,
      "required": ["room", "arch", "zone", "keeper", "requiresPieces", "escapeWalkTicks"],
      "properties": {
        "room": { "$ref": "#/$defs/room" },
        "arch": { "type": "string", "pattern": "^[0-9A-F]{4}$" },
        "zone": { "$ref": "#/$defs/rect" },
        "keeper": { "$ref": "#/$defs/point" },
        "requiresPieces": { "type": "integer", "minimum": 1, "maximum": 4 },
        "escapeWalkTicks": { "type": "integer", "minimum": 1 }
      }
    },
    "lairs": {
      "type": "array", "minItems": 4, "maxItems": 4,
      "items": {
        "type": "object", "additionalProperties": false,
        "required": ["id", "guardian", "piece"],
        "properties": {
          "id": { "type": "string", "pattern": "^lair_[a-z]+$" },
          "guardian": { "type": "string", "pattern": "^guardian_[a-z][a-z0-9_]*$" },
          "piece": {
            "type": "object", "additionalProperties": false, "required": ["id", "frame", "slot"],
            "properties": {
              "id": { "type": "string", "pattern": "^amulet_[a-z]+$" },
              "frame": { "type": "string", "pattern": "^[a-z0-9_]+$" },
              "slot": { "type": "integer", "minimum": 0, "maximum": 3 }
            }
          }
        }
      }
    },
    "amuletSets": {
      "type": "object", "additionalProperties": false, "required": ["source", "quarters", "sets", "pedestals"],
      "properties": {
        "source": { "type": "string" },
        "quarters": {
          "type": "array", "minItems": 4, "maxItems": 4, "uniqueItems": true,
          "items": { "type": "string", "pattern": "^lair_[a-z]+$" }
        },
        "sets": {
          "type": "array", "minItems": 1,
          "items": { "type": "array", "minItems": 4, "maxItems": 4, "uniqueItems": true, "items": { "$ref": "#/$defs/room" } }
        },
        "pedestals": {
          "type": "object",
          "propertyNames": { "pattern": "^[0-9]+,[0-9]+$" },
          "additionalProperties": {
            "type": "object", "additionalProperties": false, "required": ["x", "y"],
            "properties": {
              "x": { "type": "integer", "minimum": 0, "maximum": 255 },
              "y": { "type": "integer", "minimum": 0, "maximum": 191 },
              "orbitPx": { "type": "integer", "minimum": 4 }
            }
          }
        }
      }
    },
    "amulet": {
      "type": "object", "additionalProperties": false,
      "required": ["sprite", "size", "collisionBox", "pickupFlashTicks", "flyToPanelTicks"],
      "properties": {
        "sprite": { "type": "string", "pattern": "^[a-z][a-z0-9_]*$" },
        "size": {
          "type": "object", "additionalProperties": false, "required": ["w", "h"],
          "properties": { "w": { "type": "integer", "minimum": 1, "maximum": 64 }, "h": { "type": "integer", "minimum": 1, "maximum": 64 } }
        },
        "collisionBox": {
          "type": "object", "additionalProperties": false, "required": ["x", "y", "w", "h"],
          "properties": {
            "x": { "type": "integer" }, "y": { "type": "integer" },
            "w": { "type": "integer", "minimum": 1, "maximum": 64 },
            "h": { "type": "integer", "minimum": 1, "maximum": 64 }
          }
        },
        "pickupFlashTicks": { "type": "integer", "minimum": 0 },
        "flyToPanelTicks": { "type": "integer", "minimum": 1 }
      }
    },
    "shrines": {
      "type": "object", "additionalProperties": false, "required": ["object", "zone", "rooms"],
      "properties": {
        "object": { "type": "string", "pattern": "^[0-9A-F]{4}$" },
        "zone": {
          "type": "object", "additionalProperties": false, "required": ["x", "y", "w", "h"],
          "properties": {
            "x": { "type": "integer", "minimum": 0 }, "y": { "type": "integer", "minimum": 0 },
            "w": { "type": "integer", "minimum": 1 }, "h": { "type": "integer", "minimum": 1 }
          }
        },
        "rooms": { "type": "array", "uniqueItems": true, "items": { "$ref": "#/$defs/room" } }
      }
    },
    "items": {
      "type": "object", "additionalProperties": false, "required": ["pickupBox", "glanceTicks", "map", "eyes", "glass"],
      "properties": {
        "pickupBox": {
          "type": "object", "additionalProperties": false, "required": ["x", "y", "w", "h"],
          "properties": { "x": { "type": "integer" }, "y": { "type": "integer" },
                          "w": { "type": "integer", "minimum": 1 }, "h": { "type": "integer", "minimum": 1 } }
        },
        "glanceTicks": { "type": "integer", "minimum": 1 },
        "map": {
            "type": "object", "additionalProperties": false, "required": ["room", "spot", "sprite"],
            "properties": {
              "room": { "$ref": "#/$defs/room" },
              "spot": { "type": "object", "additionalProperties": false, "required": ["x", "y"],
                        "properties": { "x": { "type": "integer" }, "y": { "type": "integer" } } },
              "sprite": { "type": "string", "pattern": "^[a-z][a-z0-9_]*$" }
            }
          },
        "eyes": {
          "type": "array",
          "items": {
            "type": "object", "additionalProperties": false, "required": ["room", "spot", "sprite", "reveals"],
            "properties": {
              "room": { "$ref": "#/$defs/room" },
              "spot": { "type": "object", "additionalProperties": false, "required": ["x", "y"],
                        "properties": { "x": { "type": "integer" }, "y": { "type": "integer" } } },
              "sprite": { "type": "string", "pattern": "^[a-z][a-z0-9_]*$" },
              "reveals": { "type": "array", "minItems": 1, "uniqueItems": true, "items": { "type": "string" } }
            }
          }
        },
        "glass": {
          "description": "§14.10 [NEW]: the looking glasses, each showing the way to the next quarter for a while",
          "type": "object", "additionalProperties": false,
          "required": ["sprite", "showWayTicks", "warnTicks", "arrow", "places"],
          "properties": {
            "sprite": { "type": "string", "pattern": "^[a-z][a-z0-9_]*$" },
            "showWayTicks": { "type": "integer", "minimum": 1 },
            "warnTicks": { "type": "integer", "minimum": 0 },
            "arrow": {
              "type": "object", "additionalProperties": false,
              "required": ["sprite", "blinkTicks", "warnBlinkTicks", "insetPx"],
              "properties": {
                "sprite": { "type": "string", "pattern": "^[a-z][a-z0-9_]*$" },
                "blinkTicks": { "type": "integer", "minimum": 1 },
                "warnBlinkTicks": { "type": "integer", "minimum": 1 },
                "insetPx": { "type": "integer", "minimum": 0, "maximum": 64 }
              }
            },
            "places": {
              "type": "array", "maxItems": 8,
              "items": {
                "type": "object", "additionalProperties": false, "required": ["room", "spot"],
                "properties": {
                  "room": { "$ref": "#/$defs/room" },
                  "spot": { "type": "object", "additionalProperties": false, "required": ["x", "y"],
                            "properties": { "x": { "type": "integer" }, "y": { "type": "integer" } } }
                }
              }
            },
            "wholePlaces": {
              "description": "AGENTS.md §14.10: more glasses, lying only once the amulet is whole, to lead to the way out; places and wholePlaces together at most 8",
              "type": "array", "maxItems": 8,
              "items": {
                "type": "object", "additionalProperties": false, "required": ["room", "spot"],
                "properties": {
                  "room": { "$ref": "#/$defs/room" },
                  "spot": { "type": "object", "additionalProperties": false, "required": ["x", "y"],
                            "properties": { "x": { "type": "integer" }, "y": { "type": "integer" } } }
                }
              }
            }
          }
        }
      }
    },
    "hint": {
      "type": "object", "additionalProperties": false, "required": ["messageTicks", "oncePerLife"],
      "properties": {
        "messageTicks": { "type": "integer", "minimum": 1 },
        "oncePerLife": { "type": "boolean" }
      }
    },
    "temple": {
      "type": "object", "additionalProperties": false, "required": ["name", "rooms"],
      "properties": {
        "name": { "type": "string", "minLength": 1 },
        "rooms": { "type": "array", "uniqueItems": true, "items": { "$ref": "#/$defs/room" } }
      }
    }
  },
  "$defs": {
    "room": { "type": "string", "pattern": "^(1[0-5]|[0-9]),(1[0-5]|[0-9])$" },
    "point": {
      "type": "object", "additionalProperties": false, "required": ["x", "y"],
      "properties": { "x": { "type": "integer", "minimum": 0, "maximum": 255 }, "y": { "type": "integer", "minimum": 0, "maximum": 191 } }
    },
    "rect": {
      "type": "object", "additionalProperties": false, "required": ["x", "y", "w", "h"],
      "properties": {
        "x": { "type": "integer", "minimum": 0, "maximum": 255 }, "y": { "type": "integer", "minimum": 0, "maximum": 191 },
        "w": { "type": "integer", "minimum": 1, "maximum": 256 }, "h": { "type": "integer", "minimum": 1, "maximum": 192 }
      }
    }
  }
}
