{
  "schemaVersion": 1,
  "fidelity": "recon",
  "startFacing": "N",
  "exit": {
    "room": "8,8",
    "arch": "85C8",
    "zone": { "x": 0, "y": 0, "w": 256, "h": 103 },
    "keeper": { "x": 128, "y": 119 },
    "requiresPieces": 4,
    "escapeWalkTicks": 40
  },
  "lairs": [
    { "id": "lair_nw", "guardian": "guardian_hippo",      "piece": { "id": "amulet_nw", "frame": "nw", "slot": 0 } },
    { "id": "lair_ne", "guardian": "guardian_rhino",      "piece": { "id": "amulet_ne", "frame": "ne", "slot": 1 } },
    { "id": "lair_sw", "guardian": "guardian_boar",       "piece": { "id": "amulet_sw", "frame": "sw", "slot": 2 } },
    { "id": "lair_se", "guardian": "guardian_wildebeest", "piece": { "id": "amulet_se", "frame": "se", "slot": 3 } }
  ],
  "amuletSets": {
    "source": "Place Amulet Pieces $A255: one of the eight sets at $A29D, a room byte each, row in the high nibble",
    "quarters": ["lair_nw", "lair_sw", "lair_ne", "lair_se"],
    "sets": [
      ["3,4", "1,9", "13,4", "11,12"],
      ["13,9", "12,10", "13,2", "6,2"],
      ["1,14", "3,7", "4,4", "13,2"],
      ["5,3", "3,12", "13,4", "9,10"],
      ["10,8", "13,4", "1,14", "2,5"],
      ["3,4", "8,5", "9,3", "7,14"],
      ["9,5", "7,10", "2,14", "1,9"],
      ["6,2", "5,3", "11,12", "3,10"]
    ],
    "pedestals": {
      "3,4": { "x": 106, "y": 84 },
      "1,9": { "x": 68, "y": 80, "orbitPx": 20 },
      "13,4": { "x": 98, "y": 84 },
      "11,12": { "x": 98, "y": 84 },
      "13,9": { "x": 106, "y": 84 },
      "12,10": { "x": 106, "y": 84 },
      "13,2": { "x": 106, "y": 84 },
      "6,2": { "x": 106, "y": 84 },
      "1,14": { "x": 98, "y": 84 },
      "3,7": { "x": 98, "y": 84 },
      "4,4": { "x": 98, "y": 84 },
      "5,3": { "x": 106, "y": 84 },
      "3,12": { "x": 106, "y": 84 },
      "9,10": { "x": 106, "y": 84 },
      "10,8": { "x": 106, "y": 84 },
      "2,5": { "x": 68, "y": 80, "orbitPx": 20 },
      "8,5": { "x": 106, "y": 84 },
      "9,3": { "x": 60, "y": 80, "orbitPx": 12 },
      "7,14": { "x": 60, "y": 80, "orbitPx": 12 },
      "9,5": { "x": 106, "y": 84 },
      "7,10": { "x": 106, "y": 84 },
      "2,14": { "x": 60, "y": 80, "orbitPx": 12 },
      "3,10": { "x": 60, "y": 80, "orbitPx": 12 }
    }
  },
  "amulet": {
    "sprite": "amulet_piece",
    "size": { "w": 16, "h": 16 },
    "collisionBox": { "x": -8, "y": -16, "w": 16, "h": 16 },
    "pickupFlashTicks": 8,
    "flyToPanelTicks": 24
  },
  "shrines": {
    "object": "8E18",
    "zone": { "x": 104, "y": 88, "w": 48, "h": 16 },
    "rooms": ["4,3", "2,5", "1,9", "2,13", "3,13"]
  },
  "items": {
    "pickupBox": { "x": -8, "y": -16, "w": 16, "h": 16 },
    "glanceTicks": 25,
    "map": { "room": "6,11", "spot": { "x": 128, "y": 96 }, "sprite": "item_map" },
    "eyes": [
      { "room": "14,6", "spot": { "x": 128, "y": 104 }, "sprite": "item_eye", "reveals": ["lair_nw", "lair_ne"] },
      { "room": "11,13", "spot": { "x": 128, "y": 104 }, "sprite": "item_eye", "reveals": ["lair_sw", "lair_se"] }
    ],
    "glass": {
      "sprite": "item_glass",
      "showWayTicks": 4500,
      "warnTicks": 500,
      "arrow": { "sprite": "way_arrow", "blinkTicks": 16, "warnBlinkTicks": 5, "insetPx": 10 },
      "places": [
        { "room": "12,5", "spot": { "x": 128, "y": 104 } },
        { "room": "4,14", "spot": { "x": 128, "y": 100 } }
      ],
      "wholePlaces": [
        { "room": "3,3", "spot": { "x": 72, "y": 100 } },
        { "room": "11,3", "spot": { "x": 128, "y": 100 } },
        { "room": "3,11", "spot": { "x": 128, "y": 104 } },
        { "room": "11,11", "spot": { "x": 128, "y": 100 } }
      ]
    }
  },
  "hint": { "messageTicks": 90, "oncePerLife": true },
  "temple": {
    "name": "The Bone Temple",
    "rooms": ["7,6", "8,7", "7,7", "9,7", "7,8", "8,8", "9,8", "8,9", "7,9", "9,9", "10,9"]
  }
}
